pmid,pmcid,title,chunk_id,text,has_full_text
28111296,12693416,Management of Alzheimer's disease-An insight of the enzymatic and other novel potential targets.,28111296_0,alzheimer s disease ad is a well known cause of memory loss and dementia in elderly people all across the world it is pathophysiologically characterized by the extracellular deposition of amyloid beta a proteins and retention of intracellular neurofibrillary tangles nfts of hyperphosphorylated tau proteins several enzymes such as lipoxygenases acetylcholinesterases secretases glycogen synthase kinase caspases sirtuins have been reported to actively participate in the pathogenesis of ad due to the limited drug for the management of ad till now only memantine and four other acetylcholinesterase inhibitors there is an urgent need to find out the novel inhibitors that could specifically act against these enzymes or therapeutically important targets and barricade or decelerate ad progression in this current review we aim to unravel various enzymes and their potential inhibitors that could be exploited against ad pathogenesis we have also covered several other important miscellaneous targets which could be used as ad therapeutics,True
35114208,12631682,Nanocarrier mediated drug delivery as an impeccable therapeutic approach against Alzheimer's disease.,35114208_0,for the past several years dementia is one of the predominantly observed groups of symptoms in a geriatric population alzheimer s disease ad is a progressive memory related neurodegenerative disease for which the current food and drug administration approved therapeutics are only meant for a symptomatic management rather than targeting the root cause of ad these therapeutics belong to two classes acetylcholine esterase inhibitors and n methyl d aspartate antagonist furthermore to facilitate neuroprotective action in ad the drugs are majorly expected to reach the specific target area in the brain for the desired efficacy thus there is a huge requirement for drug discovery and development for facilitating the entry of drugs more in brain to exert a specific action the very first line of defense and the major limitation for the entry of drugs into the brain is the blood brain barrier followed by blood cerebrospinal fluid barrier more than a barrier these mainly act as selectively permeable membranes which allows entry of specific molecules into the brain furthermore specific enzymes result in the degradation of xenobiotics all these mechanisms pose as hurdles in the way of effective drug delivery in the brain thus novel techniques need to be harbored for the facilitation of the delivery of such drugs into the brain nanocarriers are advantageous for facilitating the specific targeted drug treatment in ad as nanomedicines are one of the novels and most useful approaches for ad thus the present review mainly focuses on understanding the advanced use of nanocarriers for targeted drug delivery in the management of ad,True
39062547,11274940,Targeting Microglia in Alzheimer's Disease: Pathogenesis and Potential Therapeutic Strategies.,39062547_0,microglia as resident macrophages in the central nervous system play a multifunctional role in the pathogenesis of alzheimer s disease ad their clustering around amyloid a deposits is a core pathological feature of ad recent advances in single cell rna sequencing scrna seq and single nucleus rna sequencing snrna seq have revealed dynamic changes in microglial phenotypes over time and across different brain regions during aging and ad progression as ad advances microglia primarily exhibit impaired phagocytosis of a and tau along with the release of pro inflammatory cytokines that damage synapses and neurons targeting microglia has emerged as a potential therapeutic approach for ad treatment strategies involving microglia can be broadly categorized into two aspects enhancing microglial function this involves augmenting their phagocytic ability against a and cellular debris and mitigating neuroinflammation strategies include inhibiting tnf signaling to reduce the neuroinflammatory response triggered by microglia clinical trials exploring microglia related approaches for ad treatment have garnered attention additionally natural products show promise in enhancing beneficial effects and suppressing inflammatory responses clarifying microglial dynamics understanding their roles and exploring novel therapeutic approaches will advance our fight against ad,True
32129117,12706182,Alzheimer's disease: microglia targets and their modulation to promote amyloid phagocytosis and mitigate neuroinflammation.,32129117_0,b introduction b despite the revolutionary progress in neurodegenerative disease research there is no cure for alzheimer s disease ad this is a chronic progressive neurodegenerative disease affecting aged people and is associated with chronic neuroinflammation and amyloid beta a deposition in the brain parenchyma microglia the resident myeloid cells in the central nervous system are critically involved in the pathogenesis of ad and have emerged as a potential therapeutic target for treating or preventing ad the failure of microglia to keep up with persistent amyloid beta development along with secretion of inflammatory cytokines is detrimental to neurons and favors a accumulation b areas covered b this review illuminates the latest research that is focused on molecules and their intracellular targets that promote microglial phagocytosis and or its polarization to an anti inflammatory state b expert opinion b a robust inflammatory response of microglia is not necessary to improve their efficiency of a clearance the challenge is to master inflammatory anti inflammatory phenotypes depending on the stage of ad and to maintain efficient responses to remove a therefore promoting microglia phagocytosis without a persistent excessive inflammatory response could be a potential therapeutic strategy,True
39272998,11394242,Therapeutic Targets in Innate Immunity to Tackle Alzheimer's Disease.,39272998_0,there is an urgent need for effective disease modifying therapeutic interventions for alzheimer s disease ad the most prevalent cause of dementia with a profound socioeconomic burden most clinical trials targeting the classical hallmarks of this disease amyloid plaques and neurofibrillary tangles failed showed discrete clinical effects or were accompanied by concerning side effects there has been an ongoing search for novel therapeutic targets neuroinflammation now widely recognized as a hallmark of all neurodegenerative diseases has been proven to be a major contributor to ad pathology here we summarize the role of neuroinflammation in the pathogenesis and progression of ad and discuss potential targets such as microglia trem the complement system inflammasomes and cytosolic dna sensors we also present an overview of ongoing studies targeting specific innate immune system components highlighting the progress in this field of drug research while bringing attention to the delicate nature of innate immune modulations in ad,True
27660215,12375993,"Multitasking Microglia and Alzheimer's Disease: Diversity, Tools and Therapeutic Targets.",27660215_0,given the importance of microglia to inflammatory phagocytic and synaptic modulatory processes their function is vital in physiological and pathological brain the impairment of microglia in alzheimer s disease has been demonstrated on genetic epigenetic transcriptional and functional levels using unbiased systems level approaches recent studies have highlighted the immense phenotypic diversity of microglia including the ability to adopt distinct and dynamic phenotypes in ageing and disease we review the origins and functions of healthy microglia and the established and emerging models and techniques available for their study furthermore we highlight recent advances on the role heterogeneity and dysfunction of microglia in alzheimer s disease and discuss the potential for therapeutic interventions targeting microglia microglia selective molecular fingerprints will guide detailed functional analysis of microglial subsets and may aid in the development of therapies specifically targeting microglia,True
37424345,,Nanotechnology-based Drug Delivery for Alzheimer's and Parkinson's Diseases.,37424345_0,the delivery of drugs to the brain is quite challenging in the treatment of the central nervous system cns diseases due to the blood brain barrier and the blood cerebrospinal fluid barrier however significant developments in nanomaterials employed by nanoparticle drug delivery systems have substantial potential to cross or bypass these barriers leading to enhanced therapeutic efficacies advances in nanoplatform nanosystems based on lipids polymers and inorganic materials have been extensively studied and applied in treating alzheimer s and parkinson s diseases in this review various types of brain drug delivery nanocarriers are classified summarized and their potential as drug delivery systems in alzheimer s and parkinson s diseases is discussed finally challenges facing the clinical translation of nanoparticles from bench to bedside are highlighted,False
39271059,12609898,Amyloid-β-targeting immunotherapies for Alzheimer's disease.,39271059_0,recent advances in clinical passive immunotherapy have provided compelling evidence that eliminating amyloid a slows cognitive decline in alzheimer s disease ad however the modest benefits and side effects observed in clinical trials indicate that current immunotherapy therapy is not a panacea highlighting the need for a deeper understanding of ad mechanisms and the significance of early intervention through optimized immunotherapy or immunoprevention this review focuses on the centrality of a pathology in ad and summarizes recent clinical progress in passive and active immunotherapies targeting a discussing their lessons and failures to inform future anti a biotherapeutics design various delivery strategies to optimize a targeting immunotherapies are outlined highlighting their benefits and drawbacks in overcoming challenges such as poor stability and limited tissue accessibility of anti a biotherapeutics additionally the perspectives and challenges of immunotherapy and immunoprevention targeting a are concluded in the end aiming to guide the development of next generation anti a immunotherapeutic agents towards improved efficacy and safety,True
40810239,12340599,"Understanding the role of microglia in Alzheimer's disease: insights into mechanisms, acupuncture, and potential therapeutic targets.",40810239_0,microglia mg are immune effector cells in the central nervous system cns and play a pivotal role in the pathogenesis of various cns diseases alzheimer s disease ad is defined as a severe chronic degenerative neurological disease in humans the amyloid cascade hypothesis is a hypothesis on the pathogenesis of ad that suggests that abnormal extracellular aggregation of amyloid a peptides is the main cause of the disease although this hypothesis has been found to be convincing a growing body of evidence suggests that it does not fully explain the pathogenesis of ad neuroinflammation is a crucial element in the pathogenesis of ad as evidenced by elevated levels of inflammatory markers and the identification of ad risk genes associated with innate immune function this paper will first summarize the impact of microglia mediated neuroinflammation on ad exploring the phenotypic changes that follow microglia activation secondly the interactions between microglia a microtubule associated protein apolipoprotein e and neurons are thoroughly investigated with particular focus on the interactive mechanisms furthermore the recent progress and prospects of microglia as a diagnostic and therapeutic target for ad are analysed a review of the literature on the mechanisms regulating mg for ad at home and abroad revealed that acupuncture modulation of microglia could help to delay the progression of ad this was followed by an extensive discussion of the clinical possibilities and scientific validity of acupuncture treatment for ad with the aim of providing new insights for acupuncture modulation of mg targeting for the treatment of ad,False
39562009,11734340,The emerging field of non-invasive brain stimulation in Alzheimer's disease.,39562009_0,treating cognitive impairment is a holy grail of modern clinical neuroscience in the past few years non invasive brain stimulation is increasingly emerging as a therapeutic approach to ameliorate performance in patients with cognitive impairment and as an augmentation approach in persons whose cognitive performance is within normal limits in patients with alzheimer s disease better understanding of brain connectivity and function has allowed for the development of different non invasive brain stimulation protocols recent studies have shown that transcranial stimulation methods enhancing brain plasticity with several modalities have beneficial effects on cognitive functions amelioration has been shown in preclinical studies on behaviour of transgenic mouse models for alzheimer s pathology and in clinical studies with variable severity of cognitive impairment while the field is still grappling with issues related to the standardization of target population frequency intensity treatment duration and stimulated region positive outcomes have been reported on cognitive functions and on markers of brain pathology here we review the most encouraging protocols based on repetitive transcranial magnetic stimulation transcranial direct current stimulation transcranial alternating current stimulation visual auditory stimulation photobiomodulation and transcranial focused ultrasound which have demonstrated efficacy to enhance cognitive functions or slow cognitive decline in patients with alzheimer s disease beneficial non invasive brain stimulation effects on cognitive functions are associated with the modulation of specific brain networks the most promising results have been obtained targeting key hubs of higher level cognitive networks such as the frontal parietal network and the default mode network the personalization of stimulation parameters according to individual brain features sheds new light on optimizing non invasive brain stimulation protocols for future applications,True
38424435,12289688,The Unveiling of Therapeutic Targets for Alzheimer's Disease: An Integrative Review.,38424435_0,alzheimer s disease ad is characterized by a complex pathological landscape necessitating a comprehensive treatment approach this concise review paper delves into the idea of addressing multiple mechanisms in ad summarizing the latest research findings on pathogenesis risk factors diagnostics and therapeutic strategies the etiology of ad is multifaceted involving genetic environmental and lifestyle factors the primary feature is the accumulation of amyloid beta and tau proteins leading to neuroinflammation synaptic dysfunction oxidative stress and neuronal loss conventional single target therapies have shown limited effectiveness prompting a shift toward simultaneously addressing multiple disease related processes recent advancements in ad research underscore the potential of multifaceted therapies this review explores strategies targeting both tau aggregation and amyloid beta along with interventions to alleviate neuroinflammation enhance synaptic function and reduce oxidative stress in conclusion the review emphasizes the growing importance of addressing various pathways in ad treatment a holistic approach that targets different aspects of the disease holds promise for developing effective treatments and improving the quality of life for alzheimer s patients and their caregivers,True
39755304,,Identification of potential therapeutic targets for Alzheimer's disease from the proteomes of plasma and cerebrospinal fluid in a multicenter Mendelian randomization study.,39755304_0,certain peripheral proteins are believed to be involved in the development of alzheimer s disease ad but the roles of other new protein biomarkers are still unclear current treatments aim to manage symptoms but they are not effective in stopping the progression of the disease new drug targets are needed to prevent alzheimer s disease we used mendelian randomization mr to study drug targets for alzheimer s disease we analyzed data from the european alzheimer s and dementia biobank consortium and replicated our findings in gwas data from igap and finngen cohorts we identified genetic instruments for plasma and cerebrospinal fluid csf proteins and conducted sensitivity analyses using various methods additionally a comparison and analysis of protein protein interactions ppi were conducted to identify potential causal proteins the implications of these findings were further explored through an examination of existing ad drugs and their respective targets through mr analysis protein ad pairs were identified as statistically significant at the bonferroni level p sup sup the specific findings indicate that elevated levels of plasma cathepsin h ctsh or ci p sup sup plasma signal regulatory protein alpha sirpa or ci p sup sup plasma tmem b or ci p sup sup and csf bone sialoprotein bsp or ci p sup sup csf interleukin il or ci p sup sup csf immunoglobulin like transcript ilt or ci p sup sup are associated with an increased risk of ad while increased levels of plasma progranulin gene grn or ci p sup sup plasma triggering receptor expressed on myeloid cells trem or ci p sup sup plasma sialic acid bind immunoglobulin like lectins siglec or ci p sup sup and csf siglec or ci p sup sup are associated with a decreased risk of ad bayesian colocalization found that the above protein related genes shared the same mutation as ad increased levels of plasma ctsh sirpa tmem b csf bsp csf il and csf ilt have been found to be correlated with an elevated risk of ad whereas elevated levels of plasma grn trem siglec and csf siglec are associated with a decreased risk of developing ad further investigation through clinical trials is needed,False
12369937,3085892,Amyloid forming proteases: therapeutic targets for Alzheimer's disease.,12369937_0,alzheimer s disease is an age related neurodegenerative disease which causes global loss of cognitive function drug treatment for alzheimer s disease has been limited to agents that ameliorate behavioral symptoms but these agents are without effect on disease progression rational drug design for the treatment of alzheimer s disease now seems possible as a result of major advances in medical research in this area knowledge of the etiology of alzheimer s disease is rapidly being understood this information has uncovered relevant and novel targets for treatment at the center of the etiological progression of this disease is beta amyloid a substantial body of evidence strongly suggests that this small protein is critical to the development of alzheimer s disease the beta amyloid protein is generated by two different proteolytic cleavages recently the proteases responsible for producing the beta amyloid protein have been identified the proteases represent viable targets for therapeutic intervention against alzheimer s disease in this review we describe the biological characteristics of the beta amyloid forming proteases in the context of pharmaceutical development,False
38981028,11425895,Blood Brain Barrier-Crossing Delivery of Felodipine Nanodrug Ameliorates Anxiety-Like Behavior and Cognitive Impairment in Alzheimer's Disease.,38981028_0,alzheimer s disease ad is the most common age related neurodegenerative disorder leading to cognitive decline excessive cytosolic calcium ca sup sup accumulation plays a critical role in the pathogenesis of ad since it activates the nod like receptor family pyrin domain containing nlrp switches the endoplasmic reticulum er unfolded protein response upr toward proapoptotic signaling and promotes a seeding herein a liposomal nanodrug felodipine lnd is developed incorporating a calcium channel antagonist felodipine for alzheimer s disease treatment through a low intensity pulse ultrasound lipus irradiation assisted blood brain barrier bbb crossing drug delivery the multifunctional felodipine lnd is effectively delivered to diseased brain through applying a lipus irradiation to the skull which resulted in a series of positive effects against ad markedly the nanodrug treatment switched the er upr toward antioxidant signaling prevented the surface translocation of er calreticulin calr in microglia and inhibited the nlrp activation and a seeding in addition it promoted the degradation of damaged mitochondria via mitophagy thereby inhibiting the neuronal apoptosis therefore the anxiety like behavior and cognitive impairment of xfad mice with ad is significantly ameliorated which manifested the potential of lipus assisted bbb crossing delivery of felodipine lnd to serve as a paradigm for ad therapy based on the well recognized clinically available felodipine,True
35821145,9277852,MicroRNA-22-3p ameliorates Alzheimer's disease by targeting SOX9 through the NF-κB signaling pathway in the hippocampus.,35821145_0,studies have suggested that many down regulated mirnas identified in the brain tissue or serum of alzheimer s disease ad patients were involved in the formation of senile plaques and neurofibrillary tangles specifically our previous study revealed that microrna p mir p was significantly down regulated in ad patients however the molecular mechanism underlying the down regulation of mir p has not been comprehensively investigated the ameliorating effect of mir p on apoptosis of the a treated ht cells was detected by tunel staining flow cytometry and western blotting the cognition of mice with stereotaxic injection of agomir or antagomir of mir p was assessed by morris water maze test pathological changes in the mouse hippocampus were analyzed using hematoxylin and eosin he staining nissl staining and immunohistochemistry proteomics analysis was performed to identify the targets of mir p which were further validated using dual luciferase reporter analysis and western blotting analysis the mir p played an important role in ameliorating apoptosis in the a treated ht cells increased levels of mir p in the mouse hippocampus improved the cognition in mice although the mir p did not cause the decrease of neuronal loss in the hippocampus it reduced the a deposition proteomics analysis revealed sox protein as the target of mir p which was verified by the luciferase reporter experiments our study showed that mir p could improve apoptosis and reduce a deposition by acting on sox through the nf b signaling pathway to improve the cognition in ad mice we concluded that mir p ameliorated ad by targeting sox through the nf b signaling pathway in the hippocampus,True
37452321,10349496,Tau and neuroinflammation in Alzheimer's disease: interplay mechanisms and clinical translation.,37452321_0,alzheimer s disease ad contributes to most cases of dementia its prominent neuropathological features are the extracellular neuritic plaques and intercellular neurofibrillary tangles composed of aggregated amyloid a and hyperphosphorylated tau protein respectively in the past few decades disease modifying therapy targeting a has been the focus of ad drug development even though it is encouraging that two of these drugs have recently received accelerated us food and drug administration approval for ad treatment their efficacy or long term safety is controversial tau has received increasing attention as a potential therapeutic target since evidence indicates that tau pathology is more associated with cognitive dysfunction moreover inflammation especially neuroinflammation accompanies ad pathological processes and is also linked to cognitive deficits accumulating evidence indicates that inflammation has a complex and tight interplay with tau pathology here we review recent evidence on the interaction between tau pathology focusing on tau post translational modification and dissemination and neuroinflammatory responses including glial cell activation and inflammatory signaling pathways then we summarize the latest clinical trials targeting tau and neuroinflammation sustained and increased inflammatory responses in glial cells and neurons are pivotal cellular drivers and regulators of the exacerbation of tau pathology which further contributes to its worsening by aggravating inflammatory responses unraveling the precise mechanisms underlying the relationship between tau pathology and neuroinflammation will provide new insights into the discovery and clinical translation of therapeutic targets for ad and other tau related diseases tauopathies targeting multiple pathologies and precision therapy strategies will be the crucial direction for developing drugs for ad and other tauopathies,True
