pmid,pmcid,title,chunk_id,text,has_full_text
34181171,8236749,Recent advances on drug development and emerging therapeutic agents for Alzheimer's disease.,34181171_0,alzheimer s disease ad is a neurodegenerative old age disease that is complex multifactorial unalterable and progressive in nature the currently approved therapy includes cholinesterase inhibitors nmda receptor antagonists and their combination therapy provides only temporary symptomatic relief sincere efforts have been made by the researchers globally to identify new targets discover and develop novel therapeutic agents for the treatment of ad this brief review article is intended to cover the recent advances in drug development and emerging therapeutic agents for ad acting at different targets the article is compiled using various scientific online databases and by referring to clinicaltrials gov and alzforum alzforum org websites the upcoming therapies act on one or more targets including amyloids secretases a sub sub production amyloid deposition and immunotherapy tau proteins tau phosphorylation aggregation and immunotherapy and neuroinflammation in addition to other miscellaneous targets despite the tremendous improvement in our understanding of the underlying pathophysiology of ad only aducanumab was approved by fda for the treatment of ad in years i e since hence it is concluded that novel therapeutic strategies are required to discover and develop therapeutic agents to fight against the century old ad,True
29246246,,Rho GTPases as therapeutic targets in Alzheimer's disease.,29246246_0,the progress we have made in understanding alzheimer s disease ad pathogenesis has led to the identification of several novel pathways and potential therapeutic targets rho gtpases have been implicated as critical components in ad pathogenesis but their various functions and interactions make understanding their complex signaling challenging to study recent advancements in both the field of ad and rho gtpase drug development provide novel tools for the elucidation of rho gtpases as a viable target for ad herein we summarize the fluctuating activity of rho gtpases in various stages of ad pathogenesis and in several in vitro and in vivo ad models we also review the current pharmacological tools such as nsaids rhoa rock rac and cdc inhibitors used to target rho gtpases and their use in ad related studies finally we summarize the behavioral modifications following rho gtpase modulation in several ad mouse models as key regulators of several ad related signals rho gtpases have been studied as targets in ad however a consensus has yet to be reached regarding the stage at which targeting rho gtpases would be the most beneficial the studies discussed herein emphasize the critical role of rho gtpases and the benefits of their modulation in ad,False
40064874,11893799,Berberine-inspired ionizable lipid for self-structure stabilization and brain targeting delivery of nucleic acid therapeutics.,40064874_0,lipid nanoparticles have shown success in targeting major organs such as the liver spleen and lungs but crossing the blood brain barrier bbb remains a major challenge effective brain targeted delivery systems are essential for advancing gene therapy for neurological diseases but remain limited by low transport efficiency and poor nucleic acid stability here we report a library of ionizable lipids based on the tetrahydroisoquinoline structure of protoberberine alkaloids designed to improve bbb penetration via dopamine d receptor mediated endocytosis these nanoparticles offer three key advantages enhanced brain uptake improved nucleic acid stability through poly a self assembly and minimal immunogenicity with inherent neuroprotective properties in murine models they demonstrate therapeutic potential in alzheimer s disease glioma and cryptococcal meningitis this berberine inspired delivery system integrates precise receptor targeting with nucleic acid stabilization offering a promising platform for brain targeted therapeutics,True
35807370,,Targeting Microglia in Alzheimer's Disease: From Molecular Mechanisms to Potential Therapeutic Targets for Small Molecules.,35807370_0,alzheimer s disease ad is a common progressive and devastating neurodegenerative disorder that mainly affects the elderly microglial dysregulation amyloid beta a plaques and intracellular neurofibrillary tangles play crucial roles in the pathogenesis of ad in the brain microglia play roles as immune cells to provide protection against virus injuries and diseases they have significant contributions in the development of the brain cognition homeostasis of the brain and plasticity multiple studies have confirmed that uncontrolled microglial function can result in impaired microglial mitophagy induced a accumulation and tau pathology and a chronic neuroinflammatory environment in the brain most of the genes that are associated with ad risk are highly expressed by microglia although it was initially regarded that microglia reaction is incidental and induced by dystrophic neurites and a plaques nonetheless it has been reported by genome wide association studies that most of the risk loci for ad are located in genes that are occasionally uniquely and highly expressed in microglia this finding further suggests that microglia play significant roles in early ad stages and they be targeted for the development of novel therapeutics in this review we have summarized the molecular pathogenesis of ad microglial activities in the adult brain the role of microglia in the aging brain and the role of microglia in ad we have also particularly focused on the significance of targeting microglia for the treatment of ad,False
29332579,11865952,Alzheimer's Disease: A Systemic Review of Substantial Therapeutic Targets and the Leading Multi-functional Molecules.,29332579_0,alzheimer s disease ad is a fatal neurodegenerative disorder having a complex aetiology with numerous possible drug targets there are targets that have been known for years while more new targets and theories have also emerged beta amyloid and cholinesterases are the most significant biological targets for finding curative treatment of ad the major class of drugs used for ad till now has been the cholinesterase che inhibitors other prevailing models of molecular pathogenesis in ad include neurofibrillary tangles nfts and amyloid deposition tryptophan degradation pathway kinase and phosphatase activity imbalance and neuroinflammation the beta amyloid aggregation initiates flow of events resulting in neurotoxicity and finally clinical pathogenesis of ad furthermore apoe is another very significant entity involved in repairing and maintaining the neurons and has important role in neurodegeneration neuroinflammation being the primmest symptom for ad is essential to focus on multiple factors and complexity in interlinking disease progression pose huge challenge to find one complete curing drug with so many promising molecules having multiform pharmacological profile from all over the world however facing failures in clinical trials indicates the need to consider all aspects of the old as well as new therapeutic targets of ad until the disease mechanism is better understood it is likely that multiple targeting symptomatic and diseasemodifying is the way forward most recent approaches to find anti alzheimer s agents have focused on multi target directed agents that include targeting all glorious targets hypothesized against ad new identification of prototype candidates that could be starting point of a new way of thinking drug design has been done and many drug candidates are under preclinical evaluation the main focus of this review is to discuss the recent understanding of key targets and the development of potential therapeutic agents for the treatment of ad it also documents the current therapeutic agents in clinical trials and under development based on their main mode of action,False
38286338,12844234,"Alzheimer's disease current therapies, novel drug delivery systems and future directions for better disease management.",38286338_0,alzheimer s disease ad is a neurodegenerative disorder that escalates with time exerting a significant impact on physical and mental health and leading to death the prevalence of ad is progressively rising along with its associated economic burden and necessitates effective therapeutic approaches in the near future this review paper aims to offer an insightful overview of disease pathogenesis current fda approved drugs and drugs in different clinical phases it also explores innovative formulations and drug delivery strategies focusing on nanocarriers and long acting medications lams to enhance treatment efficacy and patient adherence the review also emphasizes preclinical evidence related to nanocarriers and their potential to improve drug bioavailability pharmacokinetics and pharmacodynamics parameters while also highlighting their ability to minimize systemic side effects by providing a comprehensive analysis this review furnishes valuable insights into different pathophysiological mechanisms for future drug development it aims to inform the development of treatment strategies and innovative formulation approaches for delivering existing molecules in alzheimer s disease ultimately striving to improve patient compliance,True
38382942,12339169,Monoclonal antibody therapy for Alzheimer's disease focusing on intracerebral targets.,38382942_0,alzheimer s disease ad is one of the most common neurodegenerative diseases due to the complexity of the disorder and the presence of the blood brain barrier bbb its drug discovery and development are facing enormous challenges especially after several failures of monoclonal antibody mab trials nevertheless the food and drug administration s approval of the mab aducanumab has ushered in a new day as we better understand the disease s pathogenesis and identify novel intracerebral therapeutic targets antibody based therapies have advanced over the past few years the mab drugs targeting amyloid or hyperphosphorylated tau protein are the focus of the current research massive neuronal loss and glial cell mediated inflammation are also the vital pathological hallmarks of ad signaling a new direction for research on mab drugs we have elucidated the mechanisms by which ad specific mabs cross the bbb to bind to targets in order to investigate therapeutic approaches to treat ad this review focuses on the promising mabs targeting intracerebral dysfunction and related strategies to cross the bbb,True
38853102,,Multi-target drugs for Alzheimer's disease.,38853102_0,alzheimer s disease ad a leading cause of dementia increasingly challenges our healthcare systems and society traditional therapies aimed at single targets have fallen short owing to the complex multifactorial nature of ad that necessitates simultaneous targeting of various disease mechanisms for clinical success therefore targeting multiple pathologies at the same time could provide a synergistic therapeutic effect the identification of new disease targets beyond the classical hallmarks of ad offers a fertile ground for the design of new multi target drugs mtds and building on existing compounds have the potential to yield in successful disease modifying therapies this review discusses the evolving landscape of mtds focusing on their potential as ad therapeutics analysis of past and current trials of compounds with multi target activity underscores the capacity of mtds to offer synergistic therapeutic effects and the flourishing genetic understanding of ad will inform and inspire the development of mtd based ad therapies,False
25045220,4101776,Diverse molecular targets for therapeutic strategies in Alzheimer's disease.,25045220_0,alzheimer s disease ad is the most common form of dementia caused by neurodegenerative process and is tightly related to amyloid a and neurofibrillary tangles the lack of early diagnostic biomarker and therapeutic remedy hinders the prevention of increasing population of ad patients every year in spite of accumulated scientific information numerous clinical trials for candidate drug targets have failed to be preceded into therapeutic development therefore ad related sufferers including patients and caregivers are desperate to seek the solution also effective ad intervention is desperately needed to reduce ad related societal threats to public health in this review we summarize various drug targets and strategies in recent preclinical studies and clinical trials for ad therapy allopathic treatment immunotherapy a production aggregation modulator tau targeting therapy and metabolic targeting some has already failed in their clinical trials and the others are still in various stages of investigations both of which give us valuable information for future research in ad therapeutic development,False
35635955,12771443,Alzheimer's disease: Updated multi-targets therapeutics are in clinical and in progress.,35635955_0,alzheimer s disease is a chronic and progressive brain neurodegenerative disease affecting over million people globally currently no effective treatment is available due to multiple factors involved in the progression of ad given that the numerous ad related targets in the disease network the multi target directed ligands mtdls strategy are considered as the promising strategy to treat ad herein the multi target compounds with without ches are in clinical and in progress are reviewed to further characterize the drug likeness and adme properties are calculated using the qikprop this review will provide highlights for the treatment of ad,True
23217740,12799483,A plaque-specific antibody clears existing β-amyloid plaques in Alzheimer's disease mice.,23217740_0,a immunotherapy is a promising therapeutic approach for alzheimer s disease preclinical studies demonstrate that plaque prevention is possible however the more relevant therapeutic removal of existing plaque has proven elusive monoclonal antibodies in development target both soluble and insoluble a peptide we hypothesized that antibody specificity for deposited plaque was critical for plaque removal since soluble a peptide would block recognition of deposited forms we developed a plaque specific antibody that targets a modified a peptide a p which showed robust clearance of pre existing plaque without causing microhemorrhage interestingly a comparator n terminal a antibody d which binds both soluble and insoluble a lacked efficacy for lowering existing plaque but manifested a significant microhemorrhage liability mechanistic studies suggested that the lack of efficacy for d was attributed to poor target engagement in plaques these studies have profound implications for the development of therapeutic a antibodies for alzheimer s disease,True
22015920,3206090,Convergent pathogenic pathways in Alzheimer's and Huntington's diseases: shared targets for drug development.,22015920_0,neurodegenerative diseases exemplified by alzheimer s disease and huntington s disease are characterized by progressive neuropsychiatric dysfunction and loss of specific neuronal subtypes although there are differences in the exact sites of pathology and the clinical profiles of these two conditions only partially overlap considerable similarities in disease mechanisms and pathogenic pathways can be observed these shared mechanisms raise the possibility of exploiting common therapeutic targets for drug development as huntington s disease has a monogenic cause it is possible to accurately identify individuals who carry the huntington s disease mutation but do not yet manifest symptoms these individuals could act as a model for alzheimer s disease to test therapeutic interventions that target shared pathogenic pathways,False
33638130,12839151,Intranasal drug delivery for treatment of Alzheimer's disease.,33638130_0,the alzheimer s disease is a neurodegenerative condition with severe consequences interfering with patient quality of life it is characterized as a progressive and irreversible brain disorder hampering memory and thinking affecting the capacity to perform daily tasks leading to physical and cognitive incapacitation the conventional treatment occurs by the oral route but it presents relevant drawbacks such as low bioavailability fast metabolism limited brain exposure and undesirable side effects the intranasal route has been proposed as a promising alternative to deliver drugs and improve the alzheimer s disease treatment still there is not a clear alternative delivery system available in the market with advantageous bioavailability and safety the aim of this review is to perform an overview on the strategies for drug intranasal delivery for alzheimer s disease treatment the advantages and disadvantages of this delivery route and the delivery systems developed so far are discussed a special focus is given on the use of permeation enhancers the types of intranasal drug delivery devices as well as possible toxicity concerns,True
33652356,12858709,Alzheimer's disease and its treatment by different approaches: A review.,33652356_0,alzheimer s disease ad is a neurodegenerative disorder that impairs mental ability development and interrupts neurocognitive function this neuropathological condition is depicted by neurodegeneration neural loss and development of neurofibrillary tangles and a plaques there is also a greater risk of developing ad at a later age for people with cardiovascular diseases hypertension and diabetes in the biomedical sciences effective treatment for alzheimer s disease is a severe obstacle there is no such treatment to cure alzheimer s disease the drug present in the market show only symptomatic relief the cause of alzheimer s disease is not fully understood and the blood brain barrier restricts drug efficacy are two main factors that hamper research stem cell based therapy has been seen as an effective secure and creative therapeutic solution to overcoming ad because of ad s multifactorial nature and inadequate care current developments in nanotechnology often offer possibilities for the delivery of active drug candidates to address certain limitations the key nanoformulations being tested against ad include polymeric nanoparticles np inorganic nps and lipid based nps nano drug delivery systems are promising vehicles for targeting several therapeutic moieties by easing drug molecules penetration across the cns and improving their bioavailability in this review we focus on the causes of the ad and their treatment by different approaches,True
38095822,12627486,Lecanemab: More Questions Than Answers!,38095822_0,the approval of lecanemab by the us food and drug administration has been touted as a defining moment in the treatment of alzheimer s disease lecanemab an anti amyloid beta monoclonal antibody is the first alzheimer s disease drug targeting amyloid beta that has shown statistically significant cognitive benefits in phase iii trials however there have been many questions raised over the clinical relevance of the otherwise minimal cognitive improvements furthermore its rapid approval has been mired in controversy in addition to the reports of adverse events such as amyloid related imaging abnormalities and several deaths of participants in the lecanemab trials here we analyze the evidence supporting lecanemab as an amyloid beta therapy and also discuss the concerns raised about its efficacy and safety,True
32284421,7196825,Noninvasive hippocampal blood-brain barrier opening in Alzheimer's disease with focused ultrasound.,32284421_0,the blood brain barrier bbb presents a significant challenge for treating brain disorders the hippocampus is a key target for novel therapeutics playing an important role in alzheimer s disease ad epilepsy and depression preclinical studies have shown that magnetic resonance mr guided low intensity focused ultrasound fus can reversibly open the bbb and facilitate delivery of targeted brain therapeutics we report initial clinical trial results evaluating the safety feasibility and reversibility of bbb opening with fus treatment of the hippocampus and entorhinal cortex ec in patients with early ad six subjects tolerated a total of fus treatments with no adverse events and neither cognitive nor neurological worsening post fus contrast mri revealed immediate and sizable hippocampal parenchymal enhancement indicating bbb opening followed by bbb closure within h the average opening was of the targeted fus volume which corresponds to of the overall hippocampus volume we demonstrate that fus can safely noninvasively transiently reproducibly and focally mediate bbb opening in the hippocampus ec in humans this provides a unique translational opportunity to investigate therapeutic delivery in ad and other conditions,False
33444675,,Nutraceutical based SIRT3 activators as therapeutic targets in Alzheimer's disease.,33444675_0,alzheimer s disease ad is the most common neurodegenerative disease and its incidence is increasing worldwide with increased lifespan currently there is no effective treatment to cure or prevent the progression of ad which indicates the need to develop novel therapeutic targets and agents sirtuins especially sirt a mitochondrial deacetylase are nad dependent histone deacetylases involved in aging and longevity accumulating evidence indicates that sirt dysfunction is strongly associated with pathologies of ad hence therapeutic modulation of sirt activity may be a novel application to ameliorate the pathologies of ad natural products commonly used in traditional medicine have wide utility and appear to have therapeutic benefits for the treatment of neurodegenerative diseases such as ad the present review summarizes the currently available natural sirt activators and their potentially neuroprotective molecular mechanisms of action that make them a promising agent in the treatment and management of neurodegenerative diseases such as ad,False
15723159,11206728,"Alzheimer's associated inflammation, potential drug targets and future therapies.",15723159_0,alzheimer s disease is the most common cause of dementia in the elderly population the most widely used treatment for alzheimer s disease at present is acetylcholinesterase inhibitors which aim to prolong cognitive function through increased synaptic activity without providing neuroprotection this treatment is only symptomatic and provides modest outcomes for patients the recent elucidation of the inflammatory pathways involved in alzheimer s disease however has opened doors for better treatment and prevention by identification of areas of therapeutic intervention that target the cause of the disease rather than the symptoms this review describes the inflammatory pathways that are thought to be present in alzheimer s disease and some of the new therapies that have shown promise via alteration or inhibition of these pathways some of the therapies included in this review which have already demonstrated beneficial effects in the treatment of alzheimer s disease or have the potential to do so are nonsteroidal anti inflammatory drugs statins rage antagonists and antioxidants,True
29298417,,Brain Shuttle Antibody for Alzheimer's Disease with Attenuated Peripheral Effector Function due to an Inverted Binding Mode.,29298417_0,receptors show promise for the transport of monoclonal antibodies mabs across the blood brain barrier however safety liabilities associated with peripheral receptor binding and fc effector function have been reported we present the brain shuttle mab bs mab technology and we investigate the role of fc effector function in vitro and in an fc receptor fc r humanized mouse model strong first infusion reactions firs were observed for a conventional mab against transferrin receptor tfr with a wild type immunoglobulin g igg fc fc effector dead constructs completely eliminated all firs remarkably no fir was observed for the bs mab construct with a native igg fc function using various bs mab constructs we show that tfr binding through the c terminal bs module attenuates fc fc r interactions primarily because of steric hindrance nevertheless bs mabs maintain effector function activity when binding their brain target thus mabs with full effector function can be transported in a stealth mode in the periphery while fully active when engaged with their brain target,False
37386015,10310781,"Amyloid β-based therapy for Alzheimer's disease: challenges, successes and future.",37386015_0,amyloid protein a is the main component of neuritic plaques in alzheimer s disease ad and its accumulation has been considered as the molecular driver of alzheimer s pathogenesis and progression a has been the prime target for the development of ad therapy however the repeated failures of a targeted clinical trials have cast considerable doubt on the amyloid cascade hypothesis and whether the development of alzheimer s drug has followed the correct course however the recent successes of a targeted trials have assuaged those doubts in this review we discussed the evolution of the amyloid cascade hypothesis over the last years and summarized its application in alzheimer s diagnosis and modification in particular we extensively discussed the pitfalls promises and important unanswered questions regarding the current anti a therapy as well as strategies for further study and development of more feasible a targeted approaches in the optimization of ad prevention and treatment,True
