pmid,pmcid,title,chunk_id,text,has_full_text
39000217,,Current View on PPAR-α and Its Relation to Neurosteroids in Alzheimer's Disease and Other Neuropsychiatric Disorders: Promising Targets in a Therapeutic Strategy.,39000217_0,peroxisome proliferator activated receptors ppars may play an important role in the pathomechanism pathogenesis of alzheimer s disease ad and several other neurological neuropsychiatric disorders ad leads to progressive alterations in the redox state ion homeostasis lipids and protein metabolism significant alterations in molecular processes and the functioning of several signaling pathways result in the degeneration and death of synapses and neuronal cells leading to the most severe dementia peroxisome proliferator activated receptor alpha ppar is among the processes affected by ad it regulates the transcription of genes related to the metabolism of cholesterol fatty acids other lipids and neurotransmission mitochondria biogenesis and function ppar is involved in the cholesterol transport to mitochondria the substrate for neurosteroid biosynthesis ppar coding enzymes such as sulfotransferases which are responsible for neurosteroid sulfation the relation between ppar and cholesterol neurosteroids may have a significant impact on the course and progression of neurodegeneration neuroprotection processes unfortunately despite many years of intensive studies the pathogenesis of ad is unknown and therapy for ad and other neurodegenerative diseases is symptomatic presenting a significant goal and challenge today this review presents recent achievements in therapeutic approaches for ad which are targeting ppar and its relation to cholesterol and neurosteroids in ad and neuropsychiatric disorders,False
23677646,12752569,β-Arrestins as potential therapeutic targets for Alzheimer's disease.,23677646_0,arrestins represent a small family of g protein coupled receptors gpcrs regulators which provide modulating effects by facilitating desensitization and internalization of gpcrs as well as initiating their own signalings recent reports have demonstrated that arrestins levels were correlated with amyloid peptide a pathology in brains of alzheimer s disease ad patients and animal models arrestins could enhance the activity of secretase via interacting with anterior pharynx defective subunit which increased a production and contributed to the pathogenesis of ad in addition a induced internalization of adrenergic receptor internalization and loss of dendritic spine in neurons were proven to be mediated by arrestins further establishing their pathogenic role in ad more importantly deletion of arrestins markedly attenuated ad pathology without causing any gross abnormality here we review the evidence about the roles of arrestins in the progression of ad in addition the established and postulated mechanisms by which arrestins mediated in ad pathogenesis are also discussed based on the role of arrestins in ad pathogenesis genetically or pharmacologically targeting arrestins might provide new opportunities for ad treatment,True
34544351,12423730,"Phytotherapeutics against Alzheimer's Disease: Mechanism, Molecular Targets and Challenges for Drug Development.",34544351_0,alzheimer s disease is inflating worldwide and is combatted by only a few approved drugs at best these drugs treat symptomatic conditions by targeting cholinesterase and n methyl d aspartate receptors most of the clinical trials in progress are focused on developing disease modifying agents that aim at single targets the one drug one target approach is failing in the case of alzheimer s disease due to its labyrinth etiopathogenesis traditional medicinal systems like ayurveda use a holistic approach encompassing the legion of medicinal plants exhibiting multimodal activity recent advances in high throughput technologies have catapulted the research in the arena of ayurveda specifically in identifying plants with potent anti alzheimer s disease properties and their phytochemical characterization nonetheless clinical trials of very few herbal medicines are in progress this review is a compendium of indian plants and ayurvedic medicines against alzheimer s disease and their paraphernalia a record of plants that are found in india with anti alzheimer s disease potential and about phytochemicals from medicinal plants have been solicited with the hope of exploring the unexplored further the molecular targets of phytochemicals isolated from commonly used medicinal plants such as acorus calamus bacopa monnieri convolvulus pluricaulis tinospora cordifolia and withania somnifera have been reviewed with respect to their multidimensional property such as antioxidant anti inflammation anti aggregation synaptic plasticity modulation cognition and memory enhancing activity in addition the strengths and challenges in ayurvedic medicine that limit its use as mainstream therapy are discussed and a framework for the development of herbal medicine has been proposed,True
32804096,7579750,Collapsin Response Mediator Proteins: Novel Targets for Alzheimer's Disease.,32804096_0,numerous experimental and postmortem studies have increasingly reported dystrophic axons and dendrites and alterations of dendritic spine morphology and density in the hippocampus as prominent changes in the early stages of alzheimer s disease ad furthermore these alterations tend to correlate well with the progressive cognitive decline observed in ad for these reasons and because these neurite structures have a capacity to re grow re establish lost connections and are critical for learning and memory there is compelling evidence to suggest that therapeutic interventions aimed at preventing their degradation or promoting their regrowth may hold tremendous promise in preventing the progression of ad in this regard collapsin response mediator proteins crmps a family of phosphoproteins playing a major role in axon guidance and dendritic growth are especially interesting the roles these proteins play in neurons and immune cells are reviewed here,False
21718217,3156324,Nuclear receptors as therapeutic targets for Alzheimer's disease.,21718217_0,alzheimer s disease ad is characterized by the accumulation and extensive deposition of amyloid a in the parenchyma of the brain this accumulation of amyloid is associated with perturbations in synaptic function impairments in energy metabolism and induction of a chronic inflammatory response which acts to promote neuronal loss and cognitive impairment currently there are no drugs that target the underlying mechanisms of ad here we propose a class of nuclear receptors as novel and promising new therapeutic targets for ad this review summarizes the literature on nuclear receptors and their effects on ad related pathophysiology nuclear receptors are attractive targets for the treatment of ad due to their ability to facilitate degradation of a affect microglial activation and suppress the inflammatory milieu of the brain liver x receptor agonists have proven difficult to move into clinical trials as long term treatment results in hepatic steatosis it is our view that ppar activation remains a promising avenue for the treatment for ad however the poor bbb permeability of the currently available agonists and the negative outcome of the phase iii clinical trials are likely to diminish interest in pursuing this target,False
35300725,8932191,Immunotherapy for Alzheimer's disease: targeting β-amyloid and beyond.,35300725_0,alzheimer s disease ad is the most common neurodegenerative disease in the elderly worldwide however the complexity of ad pathogenesis leads to discrepancies in the understanding of this disease and may be the main reason for the failure of ad drug development fortunately many ongoing preclinical and clinical studies will continually open up avenues to unravel disease mechanisms and guide strategies for ad diagnosis and drug development for example immunotherapeutic strategies targeting amyloid a and tau proteins were once deemed almost certainly effective in clinical treatment due to the excellent preclinical results however the repeated failures of clinical trials on vaccines and humanized anti a and anti tau monoclonal antibodies have resulted in doubts on this strategy recently a new anti a monoclonal antibody aducanumab has been approved by the us food and drug administration which brings us back to the realization that immunotherapy strategies targeting a may be still promising meanwhile immunotherapies based on other targets such as tau microglia and gut brain axis are also under development further research is still needed to clarify the forms and epitopes of targeted proteins to improve the accuracy and effectiveness of immunotherapeutic drugs in this review we focus on the immunotherapies based on a tau and microglia and their mechanisms of action in ad in addition we present up to date advances and future perspectives on immunotherapeutic strategies for ad,True
31797761,12277872,Progress in Target Drug Molecules for Alzheimer's Disease.,31797761_0,alzheimer s disease ad is a chronic neurodegenerative disease that widespread in the elderly the etiology of ad is complicated and its pathogenesis is still unclear although there are many researches on anti ad drugs they are limited to reverse relief symptoms and cannot treat diseases therefore the development of high efficiency anti ad drugs with no side effects has become an urgent need based on the published literature this paper summarizes the main targets of ad and their drugs and focuses on the research and development progress of these drugs in recent years,True
38590098,12461629,Potential Alzheimer's disease drug targets identified through microglial biology research.,38590098_0,microglia the primary immune cells in the brain play multifaceted roles in alzheimer s disease ad microglia can potentially mitigate the pathological progression of ad by clearing amyloid beta a deposits in the brain and through neurotrophic support in contrast disproportionate activation of microglial pro inflammatory pathways as well as excessive elimination of healthy synapses can exacerbate neurodegeneration in ad the challenge therefore lies in discerning the precise regulation of the contrasting microglial properties to harness their therapeutic potential in ad this review examines the evidence relevant to the disease modifying effects of microglial manipulators in ad preclinical models the deleterious pro inflammatory effects of microglia in ad can be ameliorated via direct suppression or indirectly through metabolic manipulation epigenetic targeting and modulation of the gut brain axis furthermore microglial clearance of a deposits in ad can be enhanced via strategically targeting microglial membrane receptors lysosomal functions and metabolism given the intricate and diverse nature of microglial responses throughout the course of ad therapeutic interventions directed at microglia warrant a tactical approach this could entail employing therapeutic regimens which concomitantly suppress pro inflammatory microglial responses while selectively enhancing a phagocytosis,True
32006534,7047718,Glycogen synthase kinase-3 signaling in Alzheimer's disease.,32006534_0,alzheimer s disease ad is the most common form of neurodegenerative disorder with dementia accounting for approximately of the all cases currently million people in the u s are living with ad and by this number is expected to double resulting in a significant socio economic burden despite intensive research the exact mechanisms that trigger ad are still not known and at the present there is no cure for it in recent years many signaling pathways associated with ad neuropathology have been explored as possible candidate targets for the treatment of this condition including glycogen synthase kinase gsk gsk is considered a key player in ad pathophysiology since dysregulation of this kinase influences all the major hallmarks of the disease including tau phosphorylation amyloid production memory neurogenesis and synaptic function the present review summarizes the current understanding of the gsk neurobiology with particular emphasis on its effects on specific signaling pathways associated with ad pathophysiology moreover it discusses the feasibility of targeting gsk for ad treatment and provides a summary of the current research effort to develop gsk inhibitors in preclinical and clinical studies,False
36043720,12704319,Circular RNAs in Alzheimer's Disease: A New Perspective of Diagnostic and Therapeutic Targets.,36043720_0,circular rnas circrnas as covalently closed single stranded noncoding rna molecules have been recently identified to involve in several biological processes principally through targeting micrornas among various neurodegenerative diseases nds accumulating evidence has proposed key roles for circrnas in the pathogenesis of alzheimer s disease ad although the exact relationship between these rna molecules and ad progression is not clear they have been believed to mostly act as mirna sponges or gene transcription modulators through the correlating with multiple proteins involved in the accumulation of amyloid a peptides as well as tau protein as ad s pathological hallmark more interestingly circrnas have also been reported to play diagnostic and therapeutic roles during the ad progression the literature review indicated that circrnas could essentially contribute to the onset and development of ad thus in the current review the circrnas biogenesis and functions are addressed at first and then the interplay between particular circrnas and ad is comprehensively discussed eventually the diagnostic and therapeutic significance of these noncoding rnas is briefly highlighted a large number of circrnas are expressed in the brain thereby these rna molecules are noticed as potential regulators of neural functions in healthy circumstances as well as in neurological disorders moreover circrnas have also been reported to have potential diagnostic and therapeutic capacities in relation to ad the most prevalent nd circrnas have been shown to act as sponges for mirnas thereby regulating the function of related mirnas including oxidative stress reduction of neuroinflammation and the formation and metabolism of a all of which developed in ad circrnas have also been proposed as biomarkers that have potential diagnostic capacities in ad despite these characteristics the use of circrnas as therapeutic targets and promising diagnostic biomarkers will require further investigation and characterization of the function of these rna molecules in ad,True
16491164,,Potential therapeutic targets in the NF-kappaB pathway for Alzheimer's disease.,16491164_0,one characteristic of alzheimer s disease is a deficit in new memory formation numerous studies and reviews have investigated targeting the creb pathway for enhancing memory in diseases such as alzheimer s in addition the possibility of targeting the nuclear factor kappab nf kappab pathway for inflammatory conditions which also play a role in alzheimer s disease has been investigated interestingly recent data concerning nf kappab functioning indicates that the development of drugs targeting nf kappab regulation may prove beneficial for memory disorders however given the complexity of nf kappab functioning the most important challenge remaining is whether to enhance or inhibit the activation nf kappab future studies undoubtedly will focus on selected targets and optimal activation levels during critical stages of specific disease pathologies this short review summarizes past studies with creb describes nf kappab functioning and highlights new data on the potential role of nf kappab in new memory formation and alzheimer s disease,False
39218078,12190531,Emerging microglial biology highlights potential therapeutic targets for Alzheimer's disease.,39218078_0,alzheimer s disease is a chronic degenerative disease of the central nervous system which primarily affects elderly people and accounts for of dementia cases the current prevailing amyloid cascade hypothesis suggests that alzheimer s disease begins with the deposition of amyloid a in the brain major therapeutic strategies target a production aggregation and clearance although many clinical trials have shown that these therapeutic strategies are not sufficient to completely improve cognitive deficits in ad patients recent genome wide association studies have identified that multiple important regulators are the most significant genetic risk factors for alzheimer s disease especially in the innate immune pathways these genetic risk factors suggest a critical role for microglia highlighting their therapeutic potential in treating neurodegenerative diseases in this review we discuss how these recently documented ad risk genes affect microglial function and ad pathology and how they can be further targeted to regulate microglial states and slow ad progression especially the highly anticipated apoe and trem targets we focused on recent findings that modulation of innate and adaptive neuroimmune microenvironment crosstalk reverses cognitive deficits in ad patients we also considered novel strategies for microglia in ad patients,True
34072862,8199025,"When Good Kinases Go Rogue: GSK3, p38 MAPK and CDKs as Therapeutic Targets for Alzheimer's and Huntington's Disease.",34072862_0,alzheimer s disease ad is a mostly sporadic brain disorder characterized by cognitive decline resulting from selective neurodegeneration in the hippocampus and cerebral cortex whereas huntington s disease hd is a monogenic inherited disorder characterized by motor abnormalities and psychiatric disturbances resulting from selective neurodegeneration in the striatum although there have been numerous clinical trials for these diseases they have been unsuccessful research conducted over the past three decades by a large number of laboratories has demonstrated that abnormal actions of common kinases play a key role in the pathogenesis of both ad and hd as well as several other neurodegenerative diseases prominent among these kinases are glycogen synthase kinase gsk p mitogen activated protein kinase mapk and some of the cyclin dependent kinases cdks after a brief summary of the molecular and cell biology of ad and hd this review covers what is known about the role of these three groups of kinases in the brain and in the pathogenesis of the two neurodegenerative disorders the potential of targeting gsk p mapk and cdks as effective therapeutics is also discussed as is a brief discussion on the utilization of recently developed drugs that simultaneously target two or all three of these groups of kinases multi kinase inhibitors either by themselves or in combination with strategies currently being used such as immunotherapy or secretase inhibitors for ad and knockdown for hd could represent a more effective therapeutic approach for these fatal neurodegenerative diseases,False
37353152,10528676,siRNA drug delivery across the blood-brain barrier in Alzheimer's disease.,37353152_0,alzheimer s disease ad is a progressive neurodegenerative disease with a few fda approved drugs that provide modest symptomatic benefits and only two fda approved disease modifying treatments for ad the advancements in understanding the causative genes and non coding sequences at the molecular level of the pathophysiology of ad have resulted in several exciting research papers that employed small interfering rna sirna based therapy although sirna is being sought by academia and biopharma industries several challenges still need to be addressed we comprehensively report the latest advances in ad pathophysiology druggable targets ongoing clinical trials and the sirna based approaches across the blood brain barrier for addressing ad this review describes the latest delivery systems employed to address this barrier critical insights and future perspectives on sirna therapy for ad are also provided,False
36430432,9697769,Alzheimer's Disease: Treatment Strategies and Their Limitations.,36430432_0,alzheimer s disease ad is the most frequent case of neurodegenerative disease and is becoming a major public health problem all over the world many therapeutic strategies have been explored for several decades however there is still no curative treatment and the priority remains prevention in this review we present an update on the clinical and physiological phase of the ad spectrum modifiable and non modifiable risk factors for ad treatment with a focus on prevention strategies then research models used in ad followed by a discussion of treatment limitations the prevention methods can significantly slow ad evolution and are currently the best strategy possible before the advanced stages of the disease indeed current drug treatments have only symptomatic effects and disease modifying treatments are not yet available drug delivery to the central nervous system remains a complex process and represents a challenge for developing therapeutic and preventive strategies studies are underway to test new techniques to facilitate the bioavailability of molecules to the brain after a deep study of the literature we find the use of soft nanoparticles in particular nanoliposomes and exosomes as an innovative approach for preventive and therapeutic strategies in reducing the risk of ad and solving problems of brain bioavailability studies show the promising role of nanoliposomes and exosomes as smart drug delivery systems able to penetrate the blood brain barrier and target brain tissues finally the different drug administration techniques for neurological disorders are discussed one of the promising therapeutic methods is the intranasal administration strategy which should be used for preclinical and clinical studies of neurodegenerative diseases,True
38614367,12858709,Treating Alzheimer's disease using nanoparticle-mediated drug delivery strategies/systems.,38614367_0,the administration of promising medications for the treatment of neurodegenerative disorders ndds such as alzheimer s disease ad parkinson s disease pd huntington s disease hd and amyotrophic lateral sclerosis als is significantly hampered by the blood brain barrier bbb nanotechnology has recently come to light as a viable strategy for overcoming this obstacle and improving drug delivery to the brain with a focus on current developments and prospects this review article examines the use of nanoparticles to overcome the bbb constraints to improve drug therapy for ad the potential for several nanoparticle based approaches such as those utilizing lipid based polymeric and inorganic nanoparticles to enhance drug transport across the bbb are highlighted to shed insight on their involvement in aiding effective drug transport to the brain methods of nanoparticle mediated drug delivery such as surface modifications functionalization and particular targeting ligands are also investigated the article also discusses the most recent findings on innovative medication formulations encapsulated within nanoparticles and the therapeutic effects they have shown in both preclinical and clinical testing this sector has difficulties and restrictions such as the need for increased safety scalability and translation to clinical applications however the major emphasis of this review aims to provide insight and contribute to the knowledge of how nanotechnology can potentially revolutionize the worldwide treatment of ndds particularly ad to enhance clinical outcomes,True
32784025,12698819,Role of tau protein in Alzheimer's disease: The prime pathological player.,32784025_0,alzheimer s disease ad is a prevalently found tauopathy characterized by memory loss and cognitive insufficiency ad is an age related neurodegenerative disease with two major hallmarks which includes extracellular amyloid plaques made of amyloid a and intracellular neurofibrillary tangles of hyperphosphorylated tau with population aging worldwide there is an indispensable need for treatment strategies that can potentially manage this developing dementia despite broad researches on targeting a in the past two decades research findings on a targeted therapeutics failed to prove efficacy in the treatment of ad tau protein with its extensive pathological role in several neurodegenerative diseases can be considered as a promising target candidate for developing therapeutic interventions the abnormal hyperphosphorylation of tau plays detrimental pathological functions which ultimately lead to neurodegeneration this review will divulge the importance of tau in ad pathogenesis the interplay of a and tau the pathological functions of tau and potential therapeutic strategies for an effective management of neuronal disorders,True
