pmid,pmcid,title,chunk_id,text,has_full_text
28252521,7932850,Alzheimer's disease pathology and the unfolded protein response: prospective pathways and therapeutic targets.,28252521_0,many vital interdependent cellular functions including proteostasis lipogenesis and ca homeostasis are executed by the endoplasmic reticulum er exogenous insults can impair er performance this must be rapidly corrected or cell death will ensue protective adaptations can boost the functional capacity of the er and form the basis of the unfolded protein response upr activated in response to the accumulation of misfolded proteins the upr can halt protein translation while increasing protein handling chaperones and the degradation of erroneous proteins through a conserved three tier molecular cascade however prolonged activation of the upr can result in the maladaptation of the system resulting in the activation of inflammatory and apoptotic effectors recently upr and its involvement in neurodegenerative disease has attracted much interest and numerous potentially drugable points of crosstalk are now emerging here we summarize the functions of the er and upr and highlight evidence for its potential role in the pathogenesis of alzheimer s disease before discussing several key targets with therapeutic potential,False
38777251,12733005,Pericytes in Alzheimer's disease: Key players and therapeutic targets.,38777251_0,alzheimer s disease ad is a devastating neurodegenerative disorder that leads to progressive cognitive decline and neuropathological changes pericytes which are vessel mural cells on the basement membrane of capillaries play a crucial role in regulating cerebrovascular functions and maintaining neurovascular unit integrity emerging research substantiates the involvement of pericytes in ad this review provides a comprehensive overview of pericytes including their structure origin and markers and various functions within the central nervous system emphatically the review explores the intricate mechanisms through which pericytes contribute to ad including their interactions with amyloid beta and apolipoprotein e as well as various signaling pathways the review also highlights potential for targeted pericyte therapy for ad with a focus on stem cell therapy and drug treatments future research directions include the classification of pericyte subtypes studies related to aging and the role of pericytes in exosome related mechanisms in ad pathology in conclusion this review consolidates current knowledge on the pivotal roles of pericytes in ad and their potential as therapeutic targets providing valuable insights for future research and clinical interventions aimed at addressing the impact of ad on patients lives,True
32814524,11678002,"Alzheimer's Disease: Related Targets, Synthesis of Available Drugs, Bioactive Compounds Under Development and Promising Results Obtained from Multi-target Approaches.",32814524_0,we describe herein the therapeutic targets involved in alzheimer s disease as well as the available drugs and their synthetic routes bioactive compounds under development are also exploited to illustrate some recent research advances on the medicinal chemistry of alzheimer s disease including structure activity relationships for some targets the importance of multi target approaches including some examples from our research projects guides new perspectives in search of more effective drug candidates this review comprises the period between and early,True
26813123,,Alzheimer's disease: Targeting the Cholinergic System.,26813123_0,acetylcholine ach has a crucial role in the peripheral and central nervous systems the enzyme choline acetyltransferase chat is responsible for synthesizing ach from acetyl coa and choline in the cytoplasm and the vesicular acetylcholine transporter vacht uptakes the neurotransmitter into synaptic vesicles following depolarization ach undergoes exocytosis reaching the synaptic cleft where it can bind its receptors including muscarinic and nicotinic receptors ach present at the synaptic cleft is promptly hydrolyzed by the enzyme acetylcholinesterase ache forming acetate and choline which is recycled into the presynaptic nerve terminal by the high affinity choline transporter cht cholinergic neurons located in the basal forebrain including the neurons that form the nucleus basalis of meynert are severely lost in alzheimer s disease ad ad is the most ordinary cause of dementia affecting million people worldwide the hallmarks of the disease are the accumulation of neurofibrillary tangles and amyloid plaques however there is no real correlation between levels of cortical plaques and ad related cognitive impairment nevertheless synaptic loss is the principal correlate of disease progression and loss of cholinergic neurons contributes to memory and attention deficits thus drugs that act on the cholinergic system represent a promising option to treat ad patients,False
21697951,3168999,New therapeutic targets in Alzheimer's disease: brain deregulation of calcium and zinc.,21697951_0,the molecular determinants of alzheimer s ad disease are still not completely known however in the past two decades a large body of evidence has indicated that an important contributing factor for the disease is the development of an unbalanced homeostasis of two signaling cations calcium ca and zinc zn both ions serve a critical role in the physiological functioning of the central nervous system but their brain deregulation promotes amyloid dysmetabolism as well as tau phosphorylation ad is also characterized by an altered glutamatergic activation and glutamate can promote both ca and zn dyshomeostasis the two cations can operate synergistically to promote the generation of free radicals that further intracellular ca and zn rises and set the stage for a self perpetuating harmful loop these phenomena can be the initial steps in the pathogenic cascade leading to ad therefore therapeutic interventions aiming at preventing ca and zn dyshomeostasis may offer a great opportunity for disease modifying strategies,False
27163828,11872870,MicroRNAs as Therapeutic Targets for Alzheimer's Disease.,27163828_0,alzheimer s disease ad is the most common cause of dementia in the elderly with increasing longevity and the absence of a cure ad has become not only a major health problem but also a heavy social and economic burden worldwide given this public health challenge and that the current approved therapy for ad is limited to symptomatic treatment i e cholinesterase inhibitors and nmda receptor antagonists exploration of new molecular pathways as novel therapeutic targets remains an attractive option for disease modifying drug development micrornas mirnas are short non coding rna that control gene expression at the post translational level by inhibiting translation of specific mrnas or degrading them dysregulation of several mirnas has been described in ad brains interestingly their molecular targets are pathways that are well established functional players in the onset and development of ad pathogenesis today several molecular tools have been developed to modulate mirna levels in vitro and in vivo these scientific advancements are affording us for the first time with the real possibility of targeting in vivo these dysregulated mirnas as a novel therapeutic approach against ad,False
28490260,12664551,Emerging treatments for Alzheimer's disease for non-amyloid and non-tau targets.,28490260_0,the number of people with dementia including alzheimer s disease is growing as a result of an ageing global population treatments available for ad only alleviate the symptoms of the disease and are effective in some people with ad for a limited time there is no disease modifying treatment available and despite research efforts the underlying mechanisms of ad and optimal treatment targets have not been fully elucidated amyloid and tau are key pathological markers of ad with ongoing trials targeting both however there are also many trials at various stages of development that primarily target other markers and processes implicated in the disease which are now being investigated areas covered this review summarizes current treatment approaches for ad and explores both repositioned and novel therapies that target non amyloid and non tau mechanisms that are in the clinical trials pipeline this includes treatments for cognitive and neuropsychiatric symptoms and potentially disease modifying therapies the studies included in this review have been obtained from searches of pubmed and clinical trials databases expert commentary there is a renewed energy in identifying better treatments for behavioural symptoms of ad using both novel drugs and repositioning existing drugs lack of success in clinical trials of drugs targeting amyloid and tau have led to a surge in targeting alternative mechanisms progress in the development of biomarkers will provide further tools for clinical trials of potential therapeutics for both symptomatic treatment and disease modification in ad,False
29562523,12833968,Multifactorial Hypothesis and Multi-Targets for Alzheimer's Disease.,29562523_0,the amyloid cascade hypothesis has been dominating drug discovery for alzheimer s disease ad for the last two decades the failure of the development of effective drugs for slowing down or reversing the progression of ad warrants the ad field to consider out of the box thinking and therapeutic approaches we propose the multifactorial hypothesis of ad emphasizing that ad is caused by multiple etiological factors which may result in common brain pathology and functional consequences through several separate but integrated molecular pathways more than one etiological factor and mechanistic pathway may be involved in a single individual with sporadic ad and different individuals may have different etiological factors involving different mechanisms pathways we urge the recognition of the multifactorial nature of ad and the paradigm shift of ad drug development from a single target to multiple targets either with the multitarget directed ligands approach or the cocktail therapy approach we believe that patient stratification and the use of the precision medicine model will also benefit ad drug discovery,True
39122455,12221416,Broadening Horizons: Exploring the Cathepsin Family as Therapeutic Targets for Alzheimer's Disease.,39122455_0,alzheimer s disease ad is an intricate neurodegenerative disorder characterized by the accumulation of misfolded proteins including beta amyloid a and tau leading to cognitive decline despite decades of research the precise mechanisms underlying its onset and progression remain elusive cathepsins are a family of lysosomal enzymes that play vital roles in cellular processes including protein degradation and regulation of immune responses emerging evidence suggests that cathepsins may be involved in ad pathogenesis cathepsins can influence the activation of microglia and astrocytes the resident immune cells in the brain however cathepsin dysfunction may lead to the accumulation of misfolded proteins notably a and tau in addition dysregulated cathepsin activity may induce an exaggerated immune response promoting chronic inflammation and neuronal dysfunction in patients with ad by unraveling the classification functions and roles of cathepsins in ad s pathogenesis this review sheds light on their intricate involvement in this devastating disease targeting cathepsin activity could be a promising and novel approach for mitigating the pathological processes that contribute to ad providing new avenues for its treatment and prevention,True
33983096,12820278,New advances in brain-targeting nano-drug delivery systems for Alzheimer's disease.,33983096_0,alzheimer s disease ad is the most common neurodegenerative disease worldwide and its incidence is increasing due to the ageing population currently the main limitations of ad treatment are low blood brain barrier permeability severe off target of drugs and immune abnormality in this review four hypotheses for alzheimer s pathogenesis and three challenges for alzheimer s drug delivery are discussed in addition this article summarises the different strategies of brain targeting nano drug delivery systems nddss developed in the last years these strategies include receptor mediated transferrin receptor low density lipoprotein receptor related protein lactoferrin receptor etc adsorption mediated cationic alkaline polypeptide cell penetrating peptides etc and transporter mediated p gp glut etc moreover it provides insights into novel strategies used in ad such as exosomes virus like particles and cell membrane coating particles hence this review will help researchers to understand the current progress in the field of nddss for the central nervous system and find new directions for ad therapy highlightscharacteristics and challenges based on the pathogenesis of ad were discussed recent advances in novel brain targeting nddss for ad over the past years were summarised,True
12558063,10845649,A critical analysis of new molecular targets and strategies for drug developments in Alzheimer's disease.,12558063_0,alzheimer s disease ad a progressive degenerative disorder of the brain is believed to be the most common cause of dementia amongst the elderly ad is characterized by the presence of amyloid deposits and neurofibrillary tangles in the brain of afflicted individuals ad is associated with a loss of the presynaptic markers of the cholinergic system in the brain areas related to memory and learning ad appears to have a heterogeneous etiology with a large percentage termed sporadic ad arising from unknown causes and a smaller fraction of early onset familial ad fad caused by mutations in one of several genes such as the beta amyloid precursor protein app and presenilins ps ps these proteins along with tau secretases such as beta amyloid cleaving enzyme bace and apolipoprotein e play important roles in the pathology of ad on therapeutic fronts there is significant research underway in the development of new inhibitors for bace ps and gamma secretase as targets for treatment of ad there is also a remarkable advancement in understanding the function of cholinesterase che in the brain and the use of che inhibitors in ad a new generation of acetyl and butyryl cholinesterase inhibitors is being studied and tested in human clinical trials for ad the development of vaccination strategies anti inflammatory agents cholesterol lowering agents anti oxidants and hormone therapy are examples of new approaches for treating or slowing the progression of ad in addition nutritional genetic and environmental factors highlight more effective preventive strategies for ad developments of early diagnostic tools and of quantitative markers are critical to better follow the course of the disease and to evaluate different therapeutic strategies in this review we attempt to critically examine recent trends in ad research from molecular genetic to clinical areas we discuss various neurobiological mechanisms that provide the basis of new targets for ad drug development all these current research efforts should lead to a deeper understanding of the pathobiochemical processes that occur in the ad brain in order to effectively diagnose and prevent their occurrence,True
27796744,12511221,Molecular and Therapeutic Targets of Genistein in Alzheimer's Disease.,27796744_0,alzheimer s disease ad is a devastating brain disorder characterized by an increased level of amyloid beta a peptide deposition and neuronal cell death leading to an impairment of learning and thinking skills the a deposition is a key factor in senile plaques of the ad brain which cause the elevation of intracellular calcium ions and the production of formidable free radicals both of which greatly contribute to the ad associated cascade leading to unstoppable neuronal loss in the hippocampal region of the brain natural products are currently considered as an alternative strategy for the discovery of novel multipotent drugs against ad they include the naturally occurring dietary soy isoflavone genistein which has been recognized to possess several health promoting effects genistein has been mainly focused because of its potential on amelioration of a induced impairment and its antioxidant capacity to scavenge the free radicals produced in ad it can also directly interact with the targeted signaling proteins and stabilize their activity to prevent ad an improved understanding of the direct interactions between genistein and target proteins would contribute to the further development of ad treatment this review mainly focuses on molecular targets and the therapeutic effects regulated by genistein which has the ability to directly target the a peptide and to control its activity involved in intracellular signaling pathways which otherwise would lead to neuronal death in the hippocampal region of the ad brain,True
34813026,8608577,Recent advances in molecular pathways and therapeutic implications targeting neuroinflammation for Alzheimer's disease.,34813026_0,alzheimer s disease ad is a major contributor of dementia leading to the degeneration of neurons in the brain with major symptoms like loss of memory and learning many evidences suggest the involvement of neuroinflammation in the pathology of ad cytokines including tnf and il are also found increasing the bace activity and expression of nf b resulting in generation of a in ad brain following the interaction of a with microglia and astrocytes other inflammatory molecules also get translocated to the site of inflammation by chemotaxis and exaggerate neuroinflammation various pathways like nf b p mapk akt mtor caspase nitric oxide and cox trigger microglia to release inflammatory cytokines ppar agonists like pioglitazone increases the phagocytosis of a and reduces inflammatory cytokine il celecoxib and roficoxib like selective cox inhibitors also ameliorate neuroinflammation non selective cox inhibitor indomethacin is also potent inhibitor of inflammatory mediators released from microglia mitophagy process is considered quite helpful in reducing inflammation due to microglia as it promotes the phagocytosis of over activated microglial cells and other inflammatory cells mitophagy induction is also beneficial in the removal of damaged mitochondria and reduction of infiltration of inflammatory molecules at the site of accumulation of the damaged mitochondria targeting these pathways and eventually ameliorating the activation of microglia can mitigate neuroinflammation and come out as a better therapeutic option for the treatment of alzheimer s disease,True
33371834,10454825,Potential Epigenetic Targets for Combating Alzheimer's Disease.,33371834_0,memory remains an obligatory regime of the human brain and impaired memory causes serious obstacles in our everyday life alzheimer s disease ad is one such neurodegenerative disease which mostly affects the elderly population above the age of marked by cognitive impairment of memory besides the known targets of ad against the several etiologies known to date the zone of epigenetics has recently evolved as an ingenious field in ad epigenetic modifications do not affect dna sequence but only long term gene expression considering the complex multifactorial nature of ad we herein discuss the various epigenetic targets which might give rise to potential therapeutic approaches we reviewed the possible epigenetic targets for ad like hdac sirtuins glial cells mirna and epigenetic modifications like dna methylation a deeper insight into these target areas can surely evolve ad diagnosis and therapeutics,True
21550318,12828788,Biomarkers in Alzheimer's disease drug development.,21550318_0,developing new therapies for alzheimer s disease ad is critically important to avoid the impending public health disaster imposed by this common disorder means must be found to prevent delay the onset or slow the progression of ad these goals will be achieved by identifying disease modifying therapies and testing them in clinical trials biomarkers play an increasingly important role in ad drug development in preclinical testing they assist in decisions to develop an agent biomarkers in phase i provide insights into toxic responses and drug metabolism and in phase ii proof of concept trials they facilitate go no go decisions and dose finding biomarkers can play a role in identifying presymptomatic patients or specific patient subgroups they can provide evidence of target engagement before clinical changes can be expected brain imaging can serve as a primary outcome in phase ii trials and as a key secondary outcome in phase iii trials magnetic resonance imaging is currently best positioned for use in large multicenter clinical trials cerebrospinal fluid csf measures of amyloid beta protein a tau protein and hyperphosphorylated tau p tau protein are sensitive and specific to the diagnosis of ad and may serve as inclusion criteria and possibly as outcomes in clinical trials targeting relevant pathways plasma measures of a are of limited diagnostic value but may provide important information as a measure of treatment response a wide variety of measures of detectable products of cellular processes are being developed as possible biomarkers accessible in the cerebrospinal fluid and plasma or serum surrogate markers that can function as outcomes in pivotal trials and reliably predict clinical outcomes are needed to facilitate primary prevention trials of asymptomatic persons where clinical measures may be of limited value fit for purpose biomarkers are increasingly available to guide ad drug development decisions,True
29484980,11354546,Innovative Therapeutic Potential of Cannabinoid Receptors as Targets in Alzheimer's Disease and Less Well-Known Diseases.,29484980_0,the discovery of cannabinoid receptors at the beginning of the s cb cloned in and cb cloned in and the availability of selective and potent cannabimimetics could only be justified by the existence of endogenous ligands that are capable of binding to them thus the characterisation and cloning of the first cannabinoid receptor cb led to the isolation and characterisation of the first endocannabinoid arachidonoylethanolamide aea two years later and the subsequent identification of a family of lipid transmitters known as the fatty acid ester arachidonoylglycerol ag the endogenous cannabinoid system is a complex signalling system that comprises transmembrane endocannabinoid receptors their endogenous ligands the endocannabinoids the specific uptake mechanisms and the enzymatic systems related to their biosynthesis and degradation the endocannabinoid system has been implicated in a wide diversity of biological processes in both the central and peripheral nervous systems including memory learning neuronal development stress and emotions food intake energy regulation peripheral metabolism and the regulation of hormonal balance through the endocrine system in this context this article will review the current knowledge of the therapeutic potential of cannabinoid receptor as a target in alzheimer s disease and other less well known diseases that include among others multiple sclerosis bone metabolism and fragile x syndrome the therapeutic applications will be addressed through the study of cannabinoid agonists acting as single drugs and multi target drugs highlighting the cb receptor agonist,True
21199770,12163420,Therapeutic targets in Alzheimer's disease and related tauopathies.,21199770_0,alzheimer s disease is a progressive neurodegenerative disease that is characterized histopathologically by the presence of plaques mainly composed of abeta amyloid and the tangles mainly composed of hyperphosphorylated tau to date there is no treatment that can reverse the disease and all the current therapeutics is directed to cope with the symptoms of the disease here we describe the efforts dedicated to attack the plaques and in more detail the process of neurofibrillary degeneration linked to the presence of the hyperphosphorylated microtubule associated protein tau we have identified the different putative targets for therapeutics and the current knowledge on them,True
23542729,12608195,Liver X receptors: emerging therapeutic targets for Alzheimer's disease.,23542729_0,alzheimer s disease ad is a complex neurodegenerative disorder typified by the pathological accumulation of amyloid peptides a and neurofibrillary tangles within the brain culminating to cognitive impairment epidemiological and biochemical data have suggested a link between cholesterol content app amyloid precursor protein processing a inflammation and ad the intricacy of the disease presents considerable challenges for the development of newer therapeutic agents liver x receptors lxra and lxr are oxysterol activated nuclear receptors that play essential role in lipid and glucose homeostasis steroidogenesis and inflammatory responses lxr signalling impacts the development of ad pathology through multiple pathways reports indicate that genetic loss of either lxra or lxr in app ps transgenic mice results in increased amyloid plaque load studies also suggest that ligand activation of lxrs in tg mice enhanced the expression of genes linked with cholesterol efflux e g apoe abca down regulated app processing and a production with significant improvement in memory functions lxr agonists have also depicted to inhibit neuroinflammation through modulation of microglial phagocytosis and by repressing the expression of cox mcp and inos in glial cells this review summarizes in brief the biology of lxrs with an emphasis on their probable pathophysiological mechanisms that may elicit the defending role of these receptors in brains of ad patients,True
